{"$schema":"https://json-schema.org/draft/2020-12/schema","$id":"https://kis-mcp.local/contracts/state/state-ownership.contract.schema.json","type":"object","additionalProperties":false,"required":["schema_version","namespace_version","project_boundary","state_root","ownership_classes","source_identity","identity_contract","resolver_contract","fingerprint_contract","compatibility"],"properties":{"schema_version":{"type":"integer","const":1},"namespace_version":{"type":"integer","const":1},"project_boundary":{"$ref":"#/$defs/absoluteWindowsPath"},"state_root":{"$ref":"#/$defs/absoluteWindowsPath"},"ownership_classes":{"type":"array","minItems":10,"maxItems":10,"uniqueItems":true,"items":{"$ref":"#/$defs/ownershipClass"}},"source_identity":{"$ref":"#/$defs/sourceIdentity"},"identity_contract":{"$ref":"#/$defs/identityContract"},"resolver_contract":{"$ref":"#/$defs/resolverContract"},"fingerprint_contract":{"$ref":"#/$defs/fingerprintContract"},"compatibility":{"$ref":"#/$defs/compatibility"}},"$defs":{"absoluteWindowsPath":{"type":"string","pattern":"^[A-Za-z]:\\\\[^<>:\"|?*]+$"},"ownershipClass":{"type":"object","additionalProperties":false,"required":["ownership_class","scope","required_identity_keys","namespace_template","state_key_required","authoritative","reconstructible"],"properties":{"ownership_class":{"type":"string","pattern":"^[a-z0-9]+(?:-[a-z0-9]+)*$","minLength":1},"scope":{"type":"string","pattern":"^[a-z0-9]+(?:-[a-z0-9]+)*$","minLength":1},"required_identity_keys":{"type":"array","maxItems":3,"uniqueItems":true,"items":{"enum":["project_id","source_id","runtime_instance_id"]}},"namespace_template":{"type":"string","minLength":1,"pattern":"^[a-z0-9_{}<>/-]+$"},"state_key_required":{"type":"boolean"},"authoritative":{"type":"boolean"},"reconstructible":{"type":"boolean"}}},"sourceIdentity":{"type":"object","additionalProperties":false,"required":["worktree_prefix","change_prefix","git_lookup_required","governed_worktree_suffix","canonical_selection"],"properties":{"worktree_prefix":{"type":"string","minLength":1},"change_prefix":{"type":"string","minLength":1},"git_lookup_required":{"type":"boolean"},"governed_worktree_suffix":{"type":"string","minLength":1},"canonical_selection":{"type":"string","minLength":1}}},"identityRule":{"type":"object","additionalProperties":false,"required":["pattern","canonicalization"],"properties":{"pattern":{"type":"string","minLength":1},"max_length":{"type":"integer","minimum":1},"canonicalization":{"type":"array","minItems":1,"uniqueItems":true,"items":{"type":"string","minLength":1}},"applies_to":{"type":"array","uniqueItems":true,"items":{"type":"string","minLength":1}},"case_policy":{"type":"string","minLength":1}}},"identityContract":{"type":"object","additionalProperties":false,"required":["logical_id","governed_change_id","source_id","worktree_root"],"properties":{"logical_id":{"$ref":"#/$defs/identityRule"},"governed_change_id":{"$ref":"#/$defs/identityRule"},"source_id":{"$ref":"#/$defs/identityRule"},"worktree_root":{"type":"object","additionalProperties":false,"required":["path_kind","boundary","canonicalization","digest"],"properties":{"path_kind":{"type":"string","minLength":1},"boundary":{"$ref":"#/$defs/absoluteWindowsPath"},"canonicalization":{"type":"array","minItems":1,"uniqueItems":true,"items":{"type":"string","minLength":1}},"digest":{"type":"string","minLength":1}}}}},"resolverContract":{"type":"object","additionalProperties":false,"required":["request_schema","result_schema","error_schema","diagnostic_limits","error_codes"],"properties":{"request_schema":{"type":"string","pattern":"^[A-Za-z0-9._-]+\\.schema\\.json$"},"result_schema":{"type":"string","pattern":"^[A-Za-z0-9._-]+\\.schema\\.json$"},"error_schema":{"type":"string","pattern":"^[A-Za-z0-9._-]+\\.schema\\.json$"},"diagnostic_limits":{"type":"object","additionalProperties":false,"required":["max_fields","max_key_length","max_value_length"],"properties":{"max_fields":{"type":"integer","minimum":1},"max_key_length":{"type":"integer","minimum":1},"max_value_length":{"type":"integer","minimum":1}}},"error_codes":{"type":"array","minItems":1,"uniqueItems":true,"items":{"type":"string","pattern":"^STATE_[A-Z0-9_]+$"}}}},"fingerprintContract":{"type":"object","additionalProperties":false,"required":["algorithm","encoding","document_fields","canonical_json","test_vector"],"properties":{"algorithm":{"type":"string","minLength":1},"encoding":{"type":"string","minLength":1},"document_fields":{"type":"array","minItems":1,"uniqueItems":true,"items":{"type":"string","minLength":1}},"canonical_json":{"type":"object","additionalProperties":false,"required":["ensure_ascii","sort_keys","separators","trailing_newline"],"properties":{"ensure_ascii":{"type":"boolean"},"sort_keys":{"type":"boolean"},"separators":{"type":"array","minItems":2,"maxItems":2,"items":{"type":"string"}},"trailing_newline":{"type":"boolean"}}},"test_vector":{"type":"object","additionalProperties":false,"required":["document","identity_fingerprint"],"properties":{"document":{"type":"object","minProperties":1},"identity_fingerprint":{"type":"string","pattern":"^[0-9a-f]{64}$"}}}}},"compatibility":{"type":"object","additionalProperties":false,"required":["quarantine_root","secrets_root","github_cli_config_dir","preserved_global_roots","repo_local_recovery_capsule_pattern","repo_local_recovery_authoritative","legacy_external_shared_auth_is_target_namespace","consumer_migration_in_this_slice"],"properties":{"quarantine_root":{"$ref":"#/$defs/absoluteWindowsPath"},"secrets_root":{"$ref":"#/$defs/absoluteWindowsPath"},"github_cli_config_dir":{"$ref":"#/$defs/absoluteWindowsPath"},"preserved_global_roots":{"type":"object","minProperties":1,"additionalProperties":{"$ref":"#/$defs/absoluteWindowsPath"}},"repo_local_recovery_capsule_pattern":{"type":"string","minLength":1},"repo_local_recovery_authoritative":{"type":"boolean"},"legacy_external_shared_auth_is_target_namespace":{"type":"boolean"},"consumer_migration_in_this_slice":{"type":"boolean"}}}}}
