{"schema_version":1,"namespace_version":1,"project_boundary":"C:\\Projects","state_root":"C:\\Projects\\.kis-mcp","ownership_classes":[{"ownership_class":"global-authority","scope":"global","required_identity_keys":[],"namespace_template":"global/authority/{state_key}","state_key_required":true,"authoritative":true,"reconstructible":false},{"ownership_class":"global-cache","scope":"global","required_identity_keys":[],"namespace_template":"global/cache/{state_key}","state_key_required":true,"authoritative":false,"reconstructible":true},{"ownership_class":"shared-auth","scope":"global","required_identity_keys":[],"namespace_template":"global/auth/{state_key}","state_key_required":true,"authoritative":true,"reconstructible":false},{"ownership_class":"project-specific","scope":"project","required_identity_keys":["project_id"],"namespace_template":"projects/{project_id}/state/{state_key}","state_key_required":true,"authoritative":true,"reconstructible":false},{"ownership_class":"worktree-specific","scope":"source","required_identity_keys":["project_id","source_id"],"namespace_template":"projects/{project_id}/sources/{source_id}/state/{state_key}","state_key_required":true,"authoritative":true,"reconstructible":false},{"ownership_class":"runtime-instance-specific","scope":"runtime","required_identity_keys":["runtime_instance_id"],"namespace_template":"runtime/{runtime_instance_id}/state/{state_key}","state_key_required":true,"authoritative":false,"reconstructible":true},{"ownership_class":"ephemeral","scope":"runtime-source","required_identity_keys":["runtime_instance_id","project_id","source_id"],"namespace_template":"runtime/{runtime_instance_id}/projects/{project_id}/sources/{source_id}/ephemeral/{state_key}","state_key_required":true,"authoritative":false,"reconstructible":true},{"ownership_class":"reconstructible-cache","scope":"source","required_identity_keys":["project_id","source_id"],"namespace_template":"projects/{project_id}/sources/{source_id}/reconstructible/{state_key}","state_key_required":true,"authoritative":false,"reconstructible":true},{"ownership_class":"durable-evidence","scope":"source","required_identity_keys":["project_id","source_id"],"namespace_template":"projects/{project_id}/sources/{source_id}/evidence/{state_key}","state_key_required":true,"authoritative":true,"reconstructible":false},{"ownership_class":"recovery-quarantine","scope":"global-recovery","required_identity_keys":[],"namespace_template":"quarantine","state_key_required":false,"authoritative":true,"reconstructible":false}],"source_identity":{"worktree_prefix":"worktree-","change_prefix":"change-","git_lookup_required":false,"governed_worktree_suffix":"\\.work\\worktrees\\<governed-change-id>","canonical_selection":"governed-worktree-change-id-otherwise-worktree-root-digest"},"identity_contract":{"logical_id":{"pattern":"^[a-z0-9]+(?:-[a-z0-9]+)*$","max_length":128,"canonicalization":["strip","casefold"],"applies_to":["project_id","runtime_instance_id","state_key"]},"governed_change_id":{"pattern":"^[0-9]{3}-[a-z0-9]+(?:-[a-z0-9]+)*$","canonicalization":["strip"],"case_policy":"lowercase-required"},"source_id":{"pattern":"^(?:worktree-[0-9a-f]{64}|change-[0-9]{3}-[a-z0-9]+(?:-[a-z0-9]+)*)$","canonicalization":["strip","casefold"]},"worktree_root":{"path_kind":"absolute-windows-path","boundary":"C:\\Projects","canonicalization":["strip","replace-forward-slashes","normalize-windows-path","normpath","normcase"],"digest":"sha256-utf8"}},"resolver_contract":{"request_schema":"state-namespace-request.schema.json","result_schema":"state-namespace-result.schema.json","error_schema":"state-namespace-error.schema.json","diagnostic_limits":{"max_fields":8,"max_key_length":64,"max_value_length":160},"error_codes":["STATE_OWNERSHIP_INVALID","STATE_REQUEST_INVALID","STATE_ROOT_INVALID","STATE_KEY_MISSING","STATE_KEY_UNEXPECTED","STATE_KEY_INVALID","STATE_IDENTITY_MISSING","STATE_IDENTITY_UNEXPECTED","STATE_IDENTITY_INVALID","STATE_IDENTITY_COLLISION","STATE_IDENTITY_STALE","STATE_SOURCE_IDENTITY_INVALID","STATE_NAMESPACE_INVALID","STATE_NAMESPACE_ESCAPE","STATE_NAMESPACE_COLLISION"]},"fingerprint_contract":{"algorithm":"sha256","encoding":"utf-8","document_fields":["schema_version","namespace_version","ownership_class","state_key","identities","relative_path"],"canonical_json":{"ensure_ascii":true,"sort_keys":true,"separators":[",",":"],"trailing_newline":true},"test_vector":{"document":{"schema_version":1,"ownership_class":"durable-evidence","state_key":"verification","identities":{"project_id":"kis-mcp","source_id":"change-163-state-ownership-namespace"},"relative_path":"projects\\kis-mcp\\sources\\change-163-state-ownership-namespace\\evidence\\verification","namespace_version":1},"identity_fingerprint":"a85be29e8ac4309ac56107c34020ee22f2976a61637bbeb0ae53d9423cae960f"}},"compatibility":{"quarantine_root":"C:\\Projects\\.kis-mcp\\quarantine","secrets_root":"C:\\Projects\\.kis-mcp\\secrets","github_cli_config_dir":"C:\\Projects\\.mcp-external-state\\gh-config","preserved_global_roots":{"desktop_commander_root":"C:\\Projects\\.kis-mcp\\desktop-commander","python_environment_root":"C:\\Projects\\.kis-mcp\\python-env","uv_cache_root":"C:\\Projects\\.kis-mcp\\uv-cache","npm_cache_root":"C:\\Projects\\.kis-mcp\\npm-cache"},"repo_local_recovery_capsule_pattern":"<registered-project>\\.temp\\kis","repo_local_recovery_authoritative":false,"legacy_external_shared_auth_is_target_namespace":false,"consumer_migration_in_this_slice":false}}
